{
  "manifest_version": "phase6.15",
  "manifest_type": "offline_batch_dry_run_plan",
  "status": "offline_batch_dry_run_plan_created",
  "created_for_phase": "6.15",
  "inherits_from_phase": ["6.0", "6.1", "6.2", "6.3", "6.4", "6.5", "6.6", "6.7", "6.8", "6.9", "6.10", "6.11", "6.12", "6.13", "6.14"],
  "created_at": "2026-06-04T07:00:00.000Z",
  "scope": {
    "allowed": [
      "read_existing_phase6_0_plan",
      "read_existing_phase6_1_manifest",
      "read_existing_phase6_2_manifest",
      "read_existing_phase6_3_manifest",
      "read_existing_phase6_4_manifest",
      "read_existing_phase6_5_manifest",
      "read_existing_phase6_6_manifest",
      "read_existing_phase6_7_manifest",
      "read_existing_phase6_8_manifest",
      "read_existing_phase6_9_manifest",
      "read_existing_phase6_10_manifest",
      "read_existing_phase6_11_manifest",
      "read_existing_phase6_12_manifest",
      "read_existing_phase6_13_manifest",
      "read_existing_phase6_14_manifest",
      "read_existing_source_packets",
      "define_dry_run_scope",
      "define_dry_run_intent",
      "define_planned_dry_run_command",
      "define_planned_dry_run_assertions",
      "define_allowed_future_dry_run_artifacts",
      "define_forbidden_phase6_15_artifacts",
      "define_rollback_boundary",
      "define_audit_boundary"
    ],
    "forbidden": [
      "execute_dry_run",
      "execute_batch",
      "execute_approved_command",
      "run_crawler",
      "run_renderer",
      "run_recovery",
      "make_web_requests",
      "modify_source_layer",
      "generate_ai_learning_content",
      "capture_assets",
      "create_raw_snapshots",
      "create_intermediate_json",
      "create_actual_dry_run_record",
      "create_actual_dry_run_result",
      "create_actual_controlled_batch_run_record",
      "create_actual_item_level_execution_result",
      "create_actual_post_run_validation_report",
      "add_executable_dry_run_script",
      "set_crawler_allowed_true",
      "set_renderer_allowed_true",
      "set_recovery_allowed_true",
      "set_web_requests_allowed_true",
      "set_ai_learning_generation_allowed_true"
    ]
  },
  "plan_status": "planned_not_executed",
  "dry_run_status": "not_started",
  "dry_run_executed": false,
  "batch_run_executed": false,
  "run_command_approved": true,
  "command_status": "approved",
  "command_is_executable_now": true,
  "command_has_been_executed": false,
  "run_mode": "offline_existing_source_packet_only",
  "batch_id": "phase6_1_batch_001",
  "approved_items": ["1.3"],
  "execution_authorization_status": "execution_approved",
  "operational_mode_approval_status": "operational_mode_approved",
  "plan_metadata": {
    "plan_id": "offline_batch_dry_run_plan_phase6_15_001",
    "plan_type": "offline_batch_dry_run_plan",
    "plan_phase": "6.15",
    "plan_timestamp": "2026-06-04T07:00:00.000Z",
    "prior_decision_phase": "6.14",
    "prior_decision_manifest": "phase6_14_offline_batch_run_command_approval_decision.json",
    "prior_decision_status": "offline_batch_run_command_approval_decision_recorded",
    "referencing_approval_phase": "6.14",
    "referencing_decision_phase": "6.11",
    "referencing_plan_phase": "6.12",
    "plan_scope": "offline_batch_dry_run_plan_only"
  },
  "dry_run_scope": {
    "eligible_items": ["1.3"],
    "deferred_items": ["9.1"],
    "quarantined_items": ["13.3"],
    "item_count": 1,
    "source_layer_mutation_allowed": false,
    "output_artifact_creation_allowed": false,
    "constraints": [
      "Only item 1.3 may be dry-run assessed",
      "9.1 remains deferred",
      "13.3 remains quarantined and ineligible",
      "No new item may be added",
      "No source layer mutation may occur",
      "No output artifact may be created in Phase 6.15"
    ]
  },
  "dry_run_intent": {
    "description": "The dry-run is intended to verify, in a later phase, the following conditions",
    "verification_targets": [
      "Approved command metadata is complete",
      "Item scope is exactly ['1.3']",
      "Existing source packet availability is sufficient",
      "No crawler/web/renderer/recovery dependency is required",
      "MIXED_TEXT_IMAGE handling rule is defined",
      "Future execution outputs can be isolated",
      "Rollback can be limited to run-scoped artifacts",
      "No Source Layer rollback is required"
    ]
  },
  "planned_dry_run_command": {
    "command_id": "phase6_15_offline_dry_run_command_001",
    "command_type": "offline_batch_dry_run",
    "command_status": "planned",
    "command_is_executable_now": false,
    "command_has_been_executed": false,
    "command_text_placeholder": "pnpm run batch:offline:dry-run -- --batch phase6_1_batch_001 --items 1.3 --mode offline_existing_source_packet_only",
    "command_is_placeholder_only": true,
    "command_not_in_package_json": true,
    "command_arguments": [
      {
        "argument": "--batch",
        "value": "phase6_1_batch_001",
        "description": "Target batch identifier"
      },
      {
        "argument": "--items",
        "value": "1.3",
        "description": "Comma-separated list of approved item IDs"
      },
      {
        "argument": "--mode",
        "value": "offline_existing_source_packet_only",
        "description": "Execution mode constraint"
      }
    ],
    "command_constraints": [
      "Command is a plan placeholder only",
      "No batch:offline:dry-run script exists in package.json",
      "Command must not be executed in Phase 6.15",
      "Command must not generate any output artifacts in Phase 6.15",
      "Command is executable only in a future dry-run execution phase"
    ]
  },
  "phase_gates": {
    "phase6_1_entry_allowed": true,
    "activation_allowed": true,
    "batch_executable": true,
    "execution_allowed": true,
    "crawler_allowed": false,
    "renderer_allowed": false,
    "recovery_allowed": false,
    "web_requests_allowed": false,
    "ai_learning_generation_allowed": false
  },
  "operational_gate_decisions": {
    "crawler_gate_decision": "not_required",
    "renderer_gate_decision": "not_required",
    "recovery_gate_decision": "not_required",
    "web_requests_gate_decision": "not_required",
    "ai_learning_generation_gate_decision": "not_allowed",
    "constraint": "All operational gates remain false. No gate is opened by this plan."
  },
  "planned_dry_run_assertions": {
    "prior_phase_chain_complete": true,
    "run_command_approved": true,
    "command_has_not_been_executed": true,
    "dry_run_has_not_been_executed": true,
    "batch_run_has_not_been_executed": true,
    "operational_gates_remain_closed": true,
    "approved_items_equals_1_3": true,
    "item_13_3_excluded": true,
    "item_9_1_deferred": true,
    "no_forbidden_input_used": true,
    "no_forbidden_output_produced": true
  },
  "allowed_future_outputs": {
    "description": "These artifacts are planned only, not created in Phase 6.15",
    "artifacts": [
      {
        "name": "dry_run_record",
        "purpose": "Records dry-run execution metadata",
        "created_when": "During future dry-run",
        "status": "planned"
      },
      {
        "name": "dry_run_audit_log",
        "purpose": "Records step-by-step dry-run trace",
        "created_when": "During future dry-run",
        "status": "planned"
      },
      {
        "name": "dry_run_item_scope_report",
        "purpose": "Records per-item dry-run scope",
        "created_when": "During future dry-run",
        "status": "planned"
      },
      {
        "name": "dry_run_validation_report",
        "purpose": "Validates dry-run invariants",
        "created_when": "After future dry-run",
        "status": "planned"
      }
    ]
  },
  "forbidden_phase6_15_artifacts": {
    "description": "Phase 6.15 must NOT create any of these artifacts",
    "artifacts": [
      "actual_dry_run_record",
      "actual_dry_run_result",
      "actual_controlled_batch_run_record",
      "actual_item_level_execution_result",
      "actual_post_run_validation_report",
      "raw_snapshots",
      "intermediate_json",
      "rendered_outputs",
      "crawler_outputs",
      "recovery_outputs",
      "web_request_results",
      "ai_learning_content",
      "source_layer_mutations",
      "captured_assets"
    ]
  },
  "no_go_confirmation": {
    "no_dry_run_execution_occurs": true,
    "no_batch_execution_occurs": true,
    "no_crawler_runs": true,
    "no_renderer_runs": true,
    "no_recovery_runs": true,
    "no_web_requests_made": true,
    "no_source_layer_modified": true,
    "no_ai_learning_generated": true,
    "no_assets_captured": true,
    "no_raw_snapshots_created": true,
    "no_intermediate_json_created": true,
    "no_package_script_added_for_dry_run": true,
    "crawler_allowed_remains_false": true,
    "renderer_allowed_remains_false": true,
    "recovery_allowed_remains_false": true,
    "web_requests_allowed_remains_false": true,
    "ai_learning_generation_allowed_remains_false": true,
    "no_dry_run_record_created": true,
    "no_dry_run_result_created": true
  },
  "operational_assertions": {
    "dry_run_execution_claimed": false,
    "batch_execution_claimed": false,
    "crawler_output_claimed": false,
    "renderer_output_claimed": false,
    "recovery_output_claimed": false,
    "ai_learning_generation_claimed": false,
    "source_layer_mutation_declared": false,
    "web_requests_declared": false,
    "raw_snapshots_created": false,
    "intermediate_json_created": false,
    "assets_captured": false
  },
  "rollback_condition": {
    "phase6_15_rollback_needed": false,
    "reason": "No rollback is required for Phase 6.15 because no dry-run occurs and no artifacts are created",
    "future_dry_run_rollback_requirements": [
      "Future dry-run rollback must remove dry-run-scoped artifacts only",
      "Future dry-run must not require source layer rollback",
      "Future dry-run must not alter global state"
    ]
  },
  "audit_condition": {